WORD,HYPERONYMS,TEXT
ЛИТРОТРИПСИЯ,Дробление,"Литротрипсия — Раздробление камня в мочевом пузыре. Словарь иностранных слов, вошедших в состав русского языка. Чудинов А.Н., 1910. ЛИТОТРИПСИЯ раздробление камня в мочевом пузыре. Словарь иностранных слов, вошедших в состав…"
ЛИТРОТРИПСИЯ,Раздробление камня в мочевом пузыре,"Литротрипсия — Раздробление камня в мочевом пузыре. Словарь иностранных слов, вошедших в состав русского языка. Чудинов А.Н., 1910. ЛИТОТРИПСИЯ раздробление камня в мочевом пузыре. Словарь иностранных слов, вошедших в состав…"
ЛИТРОТРИПСИЯ,Разрушение камней в половом органе,"Литротрипсия — Разрушение камня в полом органе (желчном пузыре, лоханке, мочеточнике, мочевом пузыре). Различают ударно волновую бесконтактную литотрипсию и лазерную литотрипсию."
ЛИТРОТРИПСИЯ,Ударно волновая операция,Литротрипсия — Различают ударно волновую бесконтактную литотрипсию и лазерную литотрипсию.
ЛИХТЕР,Морская баржа,"Лихтер — разновидность баржи, грузовое несамоходное безэкипажное однотрюмное морское судно с водонепроницаемым люковым закрытием, используемое для перевозки грузов с помощью буксирных судов и для беспричальных грузовых операций при погрузке или разгрузке на рейде глубокосидящих судов, которые не могут пройти в порт."
ЛИХТЕР,Судно,"Лихтер — разновидность баржи, грузовое несамоходное безэкипажное однотрюмное морское судно с водонепроницаемым люковым закрытием, используемое для перевозки грузов с помощью буксирных судов и для беспричальных грузовых операций при погрузке или разгрузке "
ЛИХТЕР,Мелкое парусное трехмачтовое судно,"Лихтер это мелкое одномачтовое судно для хождения по местам, неудобным для глубоко сидящих судов. 2) в Германии погонная мера, употребляемая в горном деле. Словарь иностранных слов, вошедших в состав русского языка. Чудинов А.Н., 1910. ЛИХТЕР 1)"
ЛИХТЕР,Плоскодонная баржа,"Лихтер это разновидность баржи, плоскодонное судно, для разгрузки и догрузки судов, при переходе через бар, через россыпь или нанос в устье; паузок.буксирных судов и для беспричальных грузовых операций при погрузке или разгрузке "
ЛИХТЕР,Мелкое несамоходное судно,"Лихтер —  палубное, трехмачтовое, плоскодонное судно, для разгрузки и догрузки судов, при переходе через бар, через россыпь или нанос в устье; паузок."
ЛОБЗИК,Пилка,Лобзик — Тонкая обрамленная пилка для узорного выпиливания.
ЛОБЗИК,Нож для узорного выпиливания,Лобзик — Тонкая обрамленная пилка для узорного выпиливания.
ЛОБЗИК,Ручной или ножной прибор с рамкой,"Лобзик это ручной инструмент для узорного выпиливания, а также тонкая узкая пилка в таком инструменте. — Многие ждут не дождутся вечера, когда можно сесть дома, у лампы --- выпиливать лобзиком ажурную рамку. Куприн, Поединок."
ЛОБЗИК,Инструмент с тонкой пилкой,"Лобзик — ручной инструмент для узорного выпиливания, а также тонкая узкая пилка"
ЛОБЗИК,Инструмент для выпиливания ажурных вещей из дерева или металла,"Лобзик это инструмент для выпиливания ажурных вещей из дерева или металла. Словарь иностранных слов, вошедших в состав русского языка. Чудинов А.Н., 1910. ЛОБЗИК инструмент для зажатия ленточных пилочек при выпиливании разных фигур"
ЛОГАРИФМ,Математический показатель,"Логарифм — мат. Показатель степени, в которую надо возвести число, называемое основанием, чтобы получить данное число. Таблица логарифмов."
ЛОГАРИФМ,Функция,"Логарифм — от logos отношение, и arithmos число). Число арифметической прогрессии, соответствующее числу геометрической прогрессии. Словарь иностранных слов, вошедших в состав русского языка. Чудинов А.Н., 1910. ЛОГАРИФМ греч., от logos"
ЛОГАРИФМ,Число в степени,"Логарифм это число арифметической прогрессии, соответствующее числу геометрической прогрессии. "
ЛОГАРИФМ,Возведение числа в степень,"Логарифм это число арифметической прогрессии, соответствующее числу геометрической прогрессии. "
ЛОГАРИФМ,Показатель степени,"Логарифм — Показатель степени, в к-рую надо возвести число, называемое основанием, чтобы получить данное число."
ЛОГИК,Специалист в области логики,Логик это Специалист в области логики.
ЛОГИК,Философ занимающийся логикой,"Логик — Философ, занимающийся логикой."
ЛОГИК,Мастер размышлений,Логик это Специалист в области логики.
ЛОГИК,Дедуктивист,"Логика — область науки, размышления, дедуктика"
ЛОГИК,Знающий законы мышления,"Логик — Знающий законы мышления, здраво и правильно рассуждающий. Словарь иностранных слов, вошедших в состав русского языка. Чудинов А.Н., 1910. ЛОГИК греч. logikos, от logos, рассуждение. Знающий законы мышления"
