WORD,HYPERONYMS,TEXT
ЛЕКСИКОГРАФИЯ,Словообразование,"Лексикография — раздел языкознания, занимающийся вопросами составления словарей и их изучения; наука, изучающая семантическую структуру слова, особенности слов, их толкование."
ЛЕКСИКОГРАФИЯ,Языкознание,"лексикография  это собирание слов какого-нибудь языка, приведение их в систему и издание в виде лексикона, словаря."
ЛЕКСИКОГРАФИЯ,Собирание слов,"ЛЕКСИКОГРАФИЯ  это совокупность печатных трудов словарного типа, словарная литература"
ЛЕКСИКОГРАФИЯ,Словосочетание,"лексикография — труды по лексикографии, а таже Совокупность печатных трудов словарного типа, словарная литература."
ЛЕКСИКОГРАФИЯ,Раздел лингвистики,"лексикография — это специальный раздел лингвистики, занимающийся теорией и практикой составления словарей. Он называется лексикографией"
ЛЕМЕХ,Сошник,"Лемех —  сошник у плуга, у сабана и косули, рало, лемех треугольный, наваренный сталью, и насаживается трубкою плашмя наискось на ногу сабана, он подрезывает и вздымает пласт, отрез кроит его, полица оборачивает. Передний угол лемеха: носок, а верхний: перо."
ЛЕМЕХ,Пахарь,"Лемех  это Пахарь, Стальной, служит для подрезки пласта земли, нужен для вспахивания"
ЛЕМЕХ,Часть плуга,"Лемех —  Часть плуга, подрезающая пласт земли снизу И плуги служат вот уже три года, разумеется резцы и лемехи приходилось переменять"
ЛЕМЕХ,Наконечник плуга,Лемех — острый наконечник плуга.
ЛЕМЕХ,Деталь,Лемех — это острая деталь плуга служащая для подрезания травы
ЛЕМУР,Мадагаскарская обезьяна,"Лемур — Разряд обезьян, полуобезьяны, маки, которые более походят на собак или лисиц."
ЛЕМУР,Полуобезьяна,Лемур — Полуобезьяна с длинным хвостом и удлиненными задними конечностями.
ЛЕМУР,Длиннохвостый примат,Лемур — Небольшой зверек тропических лесов - полуобезьяна с длинным хвостом и удлиненными задними конечностями.
ЛЕМУР,Примат,Лемур — представитель инфраотряда приматов лемурообразные
ЛЕМУР,Тропический зверь,"Лемур — представитель приматов, живущие в тропической местности, на о. Мадагаскар"
ЛЕНИНЕЦ,Адепт ленинизма,"Ленинец это Человек, преданный учению Ленина последовательно осуществляющий принципы ленинизма в своей деятельности. Мы - партия марксистов-ленинцев. Сталин."
ЛЕНИНЕЦ,Коммунист,"Лениец — Последователь ленинизма, коммунизма, большевистского движения."
ЛЕНИНЕЦ,Большевик,"Лениец — человек, сторонник большевистского движения"
ЛЕНИНЕЦ,Красный,"Ленинец — сторонник красных, большевиков восхваляющих идеалы Ленина"
ЛЕНИНЕЦ,Советский человек,"Ленинец это Гражданин советского союза, верно следующий учению Ленина."
ЛЕПТОСПИРОЗ,Лихорадочное заболевание,"Лептоспироз — острая инфекционная болезнь , возбудителем которой являются бактерии"
ЛЕПТОСПИРОЗ,Заразное лихорадочное заболевание,Лептоспироз это Болезнь которая характеризуется поражением капилляров
ЛЕПТОСПИРОЗ,Острая заразная болезнь,Лептоспироз это острое инфекционном заболевании с увеличением селезёнки
ЛЕПТОСПИРОЗ,Инфекционная болезнь,"Лептоспироз — инфекция часто поражающая печень , почки , мышцы"
ЛЕПТОСПИРОЗ,Заболевание,"Лептоспироз — характерна явлениями интоксикации, сопровождается волнообразной лихорадкой ."
ЛЕСИСТОСТЬ,Лесная местность,"Лесистость — степень облесённости территории . Определяется отношением покрытой лесом площади к общей площади страны , района , лесхоза и т. д.; выражается в процентах . Величина лесистости в разных районах страны может различаться в зависимости от физико-географических , климатических и почвенных условий"
ЛЕСИСТОСТЬ,Почва,"Лесистость— Минимально необходимая лесистость, противодействующая эрозии почвы в безлесных или малолесных сельскохозяйственных районах."
ЛЕСИСТОСТЬ,Опушка,"Лесистость это лесистый и сущ. лес, далее из праслав. *lěsъ, от кот. в числе прочего произошли: ст.-слав. лѣсъ, укр. ліс, белор., болг. лес,"
ЛЕСИСТОСТЬ,Лес,"Лесистость — Величина лесистости в разных районах страны может различаться в зависимости от физико-географических, климатических и почвенных условий"
ЛЕСИСТОСТЬ,Почвообразование,"лесистость — местность покрытая лесами, сформированная в процессе преобразования почвы естественным путём"
ЛЕТАРГИЯ,Забвение,"летаргия это Перен. состояние спячки, бездействие, оцепенение"
ЛЕТАРГИЯ,Спячка,"Летаргия это Состояние, похожее на сон, характеризующееся неподвижностью, отсутствием реакций на внешние раздражения, мнимая смерть."
ЛЕТАРГИЯ,Сон,"Летаргия — ( «забвение»,  «бездействие») — болезненное состояние, характеризующееся медлительностью, вялостью, усталостью. "
ЛЕТАРГИЯ,Оцепенение,"Летаргия это Болезненный сон, длящийся от нескольких часов до нескольких лет с почти неощутимыми в тяжелых случаях пульсом и дыханием"
ЛЕТАРГИЯ,Летаргический сон,Летаргия — Летаргический сон в общепринятом его понимании является выдуманным
ЛЕТЯГА,Белка,"Летяга — Животное из отряда грызунов, похожее на белку, у которого передние ноги соединены с задними широкой летательной перепонкой. Это оказалась летяга. --- По бокам [у нее] между передними и задними ногами имеется эластичная складка кожи, которая позволяет ей планировать от одного дерева к другому. Арсеньев, По Уссурийской тайге."
ЛЕТЯГА,Белка-планёр,"Индийская гигантская летяга (лат. Petaurista philippensis) — грызун из рода гигантских летяг семейства беличьих. Обитает в центральном и южном Китае, Индии, Индонезии, Мьянме, Вьетнаме и Таиланде, на Шри-Ланке и Тайване."
ЛЕТЯГА,Полёвка,"Летяга это животное из отряда грызунов, похожее на белку"
ЛЕТЯГА,Грызун,"Летяга — грызун, обитает в центральном и южном Китае, Индии, Индонезии, Мьянме, Вьетнаме и Таиланде, на Шри-Ланке и Тайване."
ЛЕТЯГА,Млекапитающее,"Летяга это млекопитающее, живущее на деревьях и имеющее по бокам тела и между конечностями кожистую перепонку, которая служит для планирующего полёта"
ЛЖЕСВИДЕТЕЛЬ,Протокольный врун,"лжесвидетель — человек, дающий заведомо ложные показания судебным и следственным органам"
ЛЖЕСВИДЕТЕЛЬ,Лжец,"Лжесвидетель это Лицо, дающее ложное свидетельство о чём-л."
ЛЖЕСВИДЕТЕЛЬ,Понятой,Понятой — человек прямо или косвенно являющийся свидетелем происшествия
ЛЖЕСВИДЕТЕЛЬ,Свидетель,"Свидетель — Лицо, являющееся очевидцем преступления, либо свидетелем дающее ложные показания в протоколе."
ЛЖЕСВИДЕТЕЛЬ,Очевидец,Очевидец это человек находившийся во время преступления
ЛЖЕТЕРРОРИСТ,Обманщик,"Лжетеррорист это человек использующий средства удалённой связи для запугивания жертв, чтобы получить выгоду путём обмана"
ЛЖЕТЕРРОРИСТ,Хулиган,"Лжетеррорист — Человек нарушающий закон, являющийся преступником в жизни общества."
ЛЖЕТЕРРОРИСТ,Вредитель,"Лжетеррорист — Нарушает покой граждан, вредит мирной обстановке посредством угроз прямых или косвенных"
ЛЖЕТЕРРОРИСТ,Нарушитель,"Лжетеррорист — Нарушает покой граждан, вредит мирной обстановке посредством угроз прямых или косвенных"
ЛЖЕТЕРРОРИСТ,Преступник,"Лжетеррорист — человек являющийся преступником, впоследствии негативных действий"
ЛИВЕР,Паштет,Ливер это Внутренности годные для приготовления паштетов. Пирог с ливером.
ЛИВЕР,Печёнка,Ливер — liver - печенка) (кулин.) печень — идет на приготовление паштетов
ЛИВЕР,Печень,Ливер — печень — идет на приготовление паштетов
ЛИВЕР,Внутренности,"Ливер это съедобные внутренности - легкое, сердце и селезенка - убойных животных, особенным образом приготовленные для еды. Пирог с ливером."
ЛИВЕР,Органы,"Ливер — состав ливера входят такие органы как: печень, почки, сердце, лёгкие, диафрагма, трахея в их естественном соединении. "
ЛИГАТУРА,Знак фонетической транскрипции,"Лигатура — Знак любой системы письма или фонетической транскрипции, образованный путём соединения двух и более графем."
ЛИГАТУРА,Вспомогательный сплав,Лигатура это примесь меди или олова к золоту и серебру для придания им большей твердости (хим.). В серебре 84-й пробы 12 долей лигатуры.
ЛИГАТУРА,Хирургическая нить,"Лигатура — Шелковая, капроновая и т.п. нить для перевязывания кровеносных сосудов с целью остановки или предупреждения кровотечения при операциях."
ЛИГАТУРА,Сплав,"Лигатура — Спец. Вспомогательные сплавы, служащие для введения в расплавленный металл (или сплав) необходимых элементов с целью придания определенных свойств жидкому или затвердевшему металлу.."
ЛИГАТУРА,Примесь,Лигатура это примесь меди или олова к золоту и серебру для придания им большей твердости (хим.). В серебре 84-й пробы 12 долей лигатуры.
ЛИМОНОВЕЦ,Последователь Эдуарда Лимонова,"Лимоновец — сторонник Эдуарда «Лимонова» Савенко. Главное их оружие ― это газета «Лимонка», плакаты, торты, яйца, помидоры и баночки с краской, которыми лимо́новцы закидывают своих оппонентов и здания, в которых те прячутся от «праведного гнева народных масс». … Как только лимо́новцы пересекают ту зыбкую границу, которая отделяет стёб и эпатаж от действий, несущих хоть какую-то угрозу Системе, она начинает активно защищаться, и нацболы немедленно оказываются за решёткой."
ЛИМОНОВЕЦ,Ультрасоциалист,"Лимоновцы это нацболы. Оппозиция. В свое время Лимонов создал Национал-большевистскую партию, которую потому запретили и, кажется, не разрешили до сих пор. Название осталось. Как вы понимаете, они не фашисты, а национал-большевики. Это такой гибрид из национализма и коммунизма."
ЛИМОНОВЕЦ,Левый,Лимоновец — сторонник националистического движения
ЛИМОНОВЕЦ,Социалист,Лимоновец это национал-социолист
ЛИМОНОВЕЦ,Оппозиционер,"Лимоновцы — Оппозиция. В свое время Лимонов создал Национал-большевистскую партию, которую потому запретили и, кажется, не разрешили до сих пор. Название осталось. Как вы понимаете, они не фашисты, а национал-большевики. Это такой гибрид из н"
ЛИМФОМА,Опухоль лимфоузлов,Лимфома — обычно злокачественные новообразования лимфатической и ретикулоэндотелиальной ткани
ЛИМФОМА,Злокачественное новообразование,"Лимфома это злокачественная опухоль, образующаяся измененными клетками иммунной системы"
ЛИМФОМА,Лимфоидная ткань,Лимфома — заболевание протекающая опуханием лимфоидных тканей
ЛИМФОМА,Имунное заболевание,Лимфома — аутоимунное заболевание
ЛИМФОМА,Опухоль,Лимфома — Злокачественная опухоль лимфатических узлов
ЛИНЧЕВАТЕЛЬ,Инквизитор,"Инквизитор — рыцарь при святой церкви, занимающийся умерщвлением неверных"
ЛИНЧЕВАТЕЛЬ,Тот кто призывает к суду Линча,"Линчеватель — тот, кто линчует, призывает к суду Линча"
ЛИНЧЕВАТЕЛЬ,Вершитель самосуда,"Линчеватели это люди устраивающие самосуд над теми преступниками, которых отпустило государство."
ЛИНЧЕВАТЕЛЬ,Палач,"Линчеватели —  вершители правосудия от имени народа, в конце-концов палачи и убийцы."
ЛИНЧЕВАТЕЛЬ,Убийца,"Вершители правосудия от имени народа, в конце-концов палачи и убийцы."
ЛИНЬ,Рыба,"Лигь — рыба Сурrinus tinса, с перьями исчерна-фиолетовыми; водится в озерах и малых тинистых речках и причисляется к роду карпа (виды: чебак, короп, подуст, лещ, карась и пр.). Ходи, как линь по дну, и водой не замути. Линь по дну, а щука поверху."
ЛИНЬ,Морская веревка,"Линь — тонкая веревка белой пряжи, без смолы, но толще полутора дюйма в окружности; идет на лотлинь, сигнальные фалы и пр. Линевой, к линю (веревке) относящ. Линек м. кончик линя, для телесных наказаний на море. Не все линьком, ино и свистком, матросское. Линьковый, линечный, к линьку относящ."
ЛИНЬ,Тонкая нить,"Линь — тонкая веревка белой пряжи, без смолы, но толще полутора дюйма в окружности; идет на лотлинь, сигнальные фалы и пр. Линевой, к линю (веревке) относящ. Линек м. кончик линя, для телесных наказаний на море. Не все линьком, ино и свистком, матросское. Линьковый, линечный, к линьку относящ."
ЛИНЬ,Снасть,"Линь — тонкая веревка белой пряжи, без смолы, но толще полутора дюйма в окружности; идет на лотлинь, сигнальные фалы и пр. Линевой, к линю (веревке) относящ. Линек м. кончик линя, для телесных наказаний на море. Не все линьком, ино и свистком, матросское. Линьковый, линечный, к линьку относящ."
ЛИНЬ,Трехлярдная веревка,"Линь это Трехпрядная веревка не толще полутора дюйма в окружности. Словарь иностранных слов, вошедших в состав русского языка. Чудинов А.Н., 1910. ЛИНЬ тонкая корабельная веревка. Полный словарь иностранных слов, вошедших в употребление в… …"
ЛИПОСАКЦИЯ,Удаление подкожного жира,Липосакция — Косметическая операция по удалению подкожного жира.
ЛИПОСАКЦИЯ,Рассасывание жира,Липосакция это операция по отсасыванию лишнего жира с целью уменьшения веса.
ЛИПОСАКЦИЯ,Отсасывание жира,Липосакция это операция по отсасыванию лишнего жира с целью уменьшения веса.
ЛИПОСАКЦИЯ,Косметическая операция,Липосакция — Косметическая операция по удалению подкожного жира.
ЛИПОСАКЦИЯ,Лечебная процедура,Липосакция это Лечебная или косметическая процедура
ЛИСТЕРИОЗ,Инфекционная болезнь,"Листериоз это острая инфекционная болезнь человека и животных, чаще овец, вызываемая листериями"
ЛИСТЕРИОЗ,Заболевание человека и животных,"Листериоз это (листереллез) острая инфекционная болезнь человека и животных, чаще овец, вызываемая листериями. Симптомы многообразны, часто поражение центральной нервной системы. Человек заражается от животных. Резервуар возбудителя в природе грызуны …"
ЛИСТЕРИОЗ,Болезнь овец,"Листериоз — болезнь человека и животных, чаще овец"
ЛИСТЕРИОЗ,Болезнь вызываемая листериями,"Листериоз — острая инфекционная болезнь, вызываемая листериями."
ЛИСТЕРИОЗ,Острое инфекционное заболевание,"Листериоз — острая инфекционная болезнь человека и животных, чаще овец, вызываемая листериями."
ЛИСТИНГ,Проверка ценных бумаг,"Листинг — Внесение ценных бумаг компаний в список бумаг, котирующихся на данной бирже"
ЛИСТИНГ,Распечатка отчетов ЭВМ,"листинг — Распечатка результатов компьютерных расчетов, текста программы и т. п"
ЛИСТИНГ,Допуск к биржевым торгам,"листинг — Допуск ценных бумаг на биржу. Если выпущенные ценные бумагизарегистрированы на бирже, то можно проводить операции по их купле продаже. Акции, не внесенные в ЛИСТИНГ, продаются с прилавка на, улич ном рынке. Словарь финансовых терминов. Листинг"
ЛИСТИНГ,Внесение акции компании в акции,"Листинг — Внесение акций компании в список акций, котирующихся на данной бирже. Листинг необходим для допуска к биржевым торгам только тех акций, которые прошли экспертную проверку; 2) правила допуска ценных бумаг к торговле на"
ЛИСТИНГ,Бумажная распечатка текста,"Листинг это Распечатка результатов компьютерных расчетов, текста программы и т. п"
ЛИТРОТРИПСИЯ,Камнедробление,Литротрипсия это метод бесконтактного удаления камней — это так называемая экстракорпоральная ударно-волновая литотрипсия.
